Name,Genre,Description,Year,Runtime
Nattevagten,Thriller            ,"A law student starts working as a night watchman at The Department of Forensic Medicine in Copenhagen. His mad friend gets him on a game of dare that escalates. As a serial-killer's victims start piling up at work, he becomes a suspect.",1994,107 min
Once Were Warriors,"Crime, Drama            ",A family descended from Maori warriors is bedeviled by a violent father and the societal problems of being treated as outcasts.,1994,102 min
Pulp Fiction,"Crime, Drama            ","The lives of two mob hitmen, a boxer, a gangster and his wife, and a pair of diner bandits intertwine in four tales of violence and redemption.",1994,154 min
Speed,"Action, Adventure, Thriller            ",A young police officer must prevent a bomb exploding aboard a city bus by keeping its speed above 50 mph.,1994,116 min
The Last Seduction,"Crime, Drama, Romance            ",A devious sexpot steals her husband's drug money and hides out in a small town where she meets the perfect dupe for her next scheme.,1994,110 min
Jui kuen II,"Action, Comedy            ",A young martial artist is caught between respecting his pacifist father's wishes or stopping a group of disrespectful foreigners from stealing precious artifacts.,1994,102 min
The Shawshank Redemption,Drama            ,"Two imprisoned men bond over a number of years, finding solace and eventual redemption through acts of common decency.",1994,142 min
Trois couleurs: Rouge,"Drama, Mystery, Romance            ",A model discovers a retired judge is keen on invading people's privacy.,1994,99 min
Desperado,"Action, Crime, Thriller            ",Former musician and gunslinger El Mariachi arrives at a small Mexican border town after being away for a long time. His past quickly catches up with him and he soon gets entangled with the local drug kingpin Bucho and his gang.,1995,104 min
Heat,"Action, Crime, Drama            ",A group of high-end professional thieves start to feel the heat from the LAPD when they unknowingly leave a clue at their latest heist.,1995,170 min
La haine,"Crime, Drama            ",24 hours in the lives of three young men in the French suburbs the day after a violent riot.,1995,98 min
Se7en,"Crime, Drama, Mystery            ","Two detectives, a rookie and a veteran, hunt a serial killer who uses the seven deadly sins as his motives.",1995,127 min
The Doom Generation,"Comedy, Crime, Drama            ","Jordan White and Amy Blue, two troubled teens, pick up an adolescent drifter, Xavier Red. Together, the threesome embark on a sex-and-violence-filled journey through an America of psychos and quickie marts.",1995,83 min
The Quick and the Dead,"Action, Romance, Thriller            ","A female gunfighter returns to a frontier town where a dueling tournament is being held, which she enters in an effort to avenge her father's death.",1995,108 min
The Usual Suspects,"Crime, Drama, Mystery            ","A sole survivor tells of the twisty events leading up to a horrific gun battle on a boat, which began when five criminals met at a seemingly random police lineup.",1995,106 min
Toy Story,"Animation, Adventure, Comedy            ",A cowboy doll is profoundly threatened and jealous when a new spaceman action figure supplants him as top toy in a boy's bedroom.,1995,81 min
Welcome to the Dollhouse,"Comedy, Drama            ","An awkward seventh-grader struggles to cope with inattentive parents, snobbish class-mates, a smart older brother, an attractive younger sister and her own insecurities in suburban New Jersey.",1995,88 min
Big Night,"Drama, Romance            ","New Jersey, 1950s. Two brothers run an Italian restaurant. Business is not going well as a rival Italian restaurant is out-competing them. In a final effort to save the restaurant, the brothers plan to put on an evening of incredible food.",1996,109 min
Bottle Rocket,"Comedy, Crime, Drama            ",Three friends plan to pull off a simple robbery and go on the run.,1996,91 min
Bound,"Crime, Thriller            ",Tough ex-con Corky and her lover Violet concoct a scheme to steal millions of stashed mob money and pin the blame on Violet's crooked boyfriend Caesar.,1996,109 min
Breaking the Waves,Drama            ,"Oilman Jan is paralyzed in an accident. His wife, who prayed for his return, feels guilty; even more, when Jan urges her to have sex with another.",1996,159 min
Citizen Ruth,"Comedy, Drama            ","An irresponsible, drug-addicted, recently impregnated woman finds herself in the middle of an abortion debate when both parties attempt to sway her to their respective sides.",1996,106 min
Flirting with Disaster,Comedy            ,"A young man, his wife, and his incompetent case worker travel across country to find his birth parents.",1996,92 min
Fargo,"Crime, Thriller            ",Minnesota car salesman Jerry Lundegaard's inept crime falls apart due to his and his henchmen's bungling and the persistent police work of the quite pregnant Marge Gunderson.,1996,98 min
Freeway,"Crime, Drama, Thriller            ","A twisted take on ""Little Red Riding Hood"", with a teenage juvenile delinquent on the run from a social worker travelling to her grandmother's house and being hounded by a charming, but sadistic, serial killer and pedophile.",1996,102 min
Romeo + Juliet,"Drama, Romance            ",Shakespeare's famous play is updated to the hip modern suburb of Verona still retaining its original dialogue.,1996,120 min
Scream,"Horror, Mystery            ","A year after the murder of her mother, a teenage girl is terrorized by a new killer, who targets the girl and her friends by using horror films as part of a deadly game.",1996,111 min
Small Faces,Drama            ,"Three teenage brothers, gang-member Bobby, troubled mama's boy Alan and self-assured prankster Lex, reside in a downtrodden section of Glasgow, Scotland, circa 1968. But while Bobby and ...                See full summary »",1995,108 min
Swingers,"Comedy, Drama            ","A wannabe actor has a hard time moving on from a break-up, but he is lucky to have supportive friends.",1996,96 min
Trainspotting,Drama            ,"Renton, deeply immersed in the Edinburgh drug scene, tries to clean up and get out, despite the allure of the drugs and influence of friends.",1996,93 min
Waiting for Guffman,Comedy            ,An aspiring director and the marginally talented amateur cast of a hokey small-town Missouri musical production go overboard when they learn that someone from Broadway will be in attendance.,1996,84 min
When We Were Kings,"Documentary, Sport            ","Boxing documentary on the 1974 world heavyweight championship bout between defending champion, George Foreman, and the underdog challenger, Muhammad Ali.",1996,88 min
Boogie Nights,Drama            ,"Back when sex was safe, pleasure was a business and business was booming, an idealistic porn producer aspires to elevate his craft to an art when he discovers a hot young talent.",1997,155 min
Cube,"Drama, Horror, Mystery            ",Six complete strangers with widely varying personalities are involuntarily placed in an endless maze containing deadly traps.,1997,90 min
Hana-bi,"Crime, Drama, Romance            ","Nishi leaves the police in the face of harrowing personal and professional difficulties. Spiraling into depression, he makes questionable decisions.",1997,103 min
Funny Games,"Crime, Drama, Thriller            ","Two violent young men take a mother, father, and son hostage in their vacation cabin and force them to play sadistic ""games"" with one another for their own amusement.",1997,108 min
Grosse Pointe Blank,"Action, Comedy, Crime            ","Martin Blank is a professional assassin. He is sent on a mission to a small Detroit suburb, Grosse Pointe, and, by coincidence, his ten-year high school reunion party is taking place there at the same time.",1997,107 min
Gummo,"Comedy, Drama            ","Lonely residents of a tornado-stricken Ohio town wander the deserted landscape trying to fulfill their boring, nihilistic lives.",1997,89 min
Jackie Brown,"Crime, Drama, Thriller            ","A flight attendant with a criminal past gets nabbed by the ATF for smuggling. Under pressure to become an informant against the drug dealer she works for, she must find a way to secure her future without getting killed.",1997,154 min
L.A. Confidential,"Crime, Drama, Mystery            ","As corruption grows in 1950s Los Angeles, three policemen - one strait-laced, one brutal, and one sleazy - investigate a series of murders with their own brand of justice.",1997,138 min
Lost Highway,"Mystery, Thriller            ","Anonymous videotapes presage a musician's murder conviction, and a gangster's girlfriend leads a mechanic astray.",1997,134 min
Nil by Mouth,Drama            ,"A rough, short-tempered patriarch of a working-class family sees his life and the relationships around him slowly unravel.",1997,128 min
Retroactive,"Action, Crime, Drama            ",A psychiatrist makes multiple trips through time to save a woman that was murdered by her brutal husband.,1997,91 min
Starship Troopers,"Action, Adventure, Sci-Fi            ","Humans in a fascist, militaristic future wage war with giant alien bugs.",1997,129 min
The Ice Storm,Drama            ,"In suburban New Canaan, Connecticut, 1973, middle-class families experimenting with casual sex and substance abuse find their lives beyond their control.",1997,112 min
A Simple Plan,"Crime, Drama, Thriller            ","Three blue-collar acquaintances come across millions of dollars in lost cash and make a plan to keep their find from the authorities, but it isn't long before complications and mistrust weave their way into the plan.",1998,121 min
American History X,"Crime, Drama            ",A former neo-nazi skinhead tries to prevent his younger brother from going down the same wrong path that he did.,1998,119 min
Buffalo '66,"Comedy, Drama, Romance            ","After being released from prison, Billy is set to visit his parents with his wife, whom he does not actually have. This provokes Billy to act out, as he kidnaps a girl and forces her to act as his wife for the visit.",1998,110 min
Happiness,"Comedy, Drama            ","The lives of several individuals intertwine as they go about their lives in their own unique ways, engaging in acts society as a whole might find disturbing in a desperate search for human connection.",1998,134 min
Seul contre tous,"Crime, Drama, Thriller            ",A horse butcher's life and mind begin to break down as he lashes out against various factions of society while attempting to reconnect with his estranged daughter.,1998,93 min
Last Night,"Comedy, Drama, Romance            ",A group of very different individuals with different ideas of how to face the end come together as the world is expected to end in six hours at the turn of the century.,I 1998,95 min
Love Is the Devil: Study for a Portrait of Francis Bacon,"Biography, Drama, Romance            ","Biography of British painter Francis Bacon focuses on his relationship with his lover, George Dyer, a former small time crook.",1998,87 min
Out of Sight,"Comedy, Crime, Drama            ","A career bank robber breaks out of jail, and shares a moment of mutual attraction with a U.S. Marshal he has kidnapped.",1998,123 min
Pi,"Drama, Horror, Mystery            ",A paranoid mathematician searches for a key number that will unlock the universal patterns found in nature.,1998,84 min
Ringu,"Horror, Mystery            ",A reporter and her ex-husband investigate a cursed video tape that is rumored to kill the viewer seven days after watching it.,1998,96 min
Lola rennt,"Action, Crime, Thriller            ","After a botched money delivery, Lola has 20 minutes to come up with 100,000 Deutschmarks.",1998,81 min
Rushmore,"Comedy, Drama, Romance            ","A teenager at Rushmore Academy falls for a much older teacher and befriends a middle-aged industrialist. Later, he finds out that his love interest and his friend are having an affair, which prompts him to begin a vendetta.",1998,93 min
Festen,Drama            ,"At Helge's 60th birthday party, some unpleasant family truths are revealed.",1998,105 min
The General,"Biography, Crime, Drama            ","The real-life story of Dublin folk hero and criminal Martin Cahill, who pulled off two daring robberies in Ireland with his team, but attracted unwanted attention from the police, the I.R.A., the U.V.F., and members of his own team.",1998,124 min
There's Something About Mary,"Comedy, Romance            ","A man gets a chance to meet up with his dream girl from high school, even though his date with her back then was a complete disaster.",1998,119 min
Wild Things,"Crime, Drama, Mystery            ",A police detective uncovers a conspiracy behind a case involving a high-school guidance counselor when accusations of rape are made against him by two female students.,1998,108 min
A Room for Romeo Brass,"Comedy, Drama            ","After stopping 12 y.o. Romeo and Gavin from being beaten up, Morell drives them home and meets Romeo's adult sister and falls in love. The boys ""help"" him in his pursuit.",1999,90 min
American Movie,"Documentary, Comedy            ",Documentary about an aspiring filmmaker's attempts to finance his dream project by finally completing the low-budget horror film he abandoned years before.,1999,107 min
Ôdishon,"Drama, Horror, Mystery            ","A widower takes an offer to screen girls at a special audition, arranged for him by a friend to find him a new wife. The one he fancies is not who she appears to be after all.",1999,115 min
Being John Malkovich,"Comedy, Drama, Fantasy            ",A puppeteer discovers a portal that leads literally into the head of movie star John Malkovich.,1999,113 min
Election,"Comedy, Romance            ",A high school teacher meets his match in an over-achieving student politician.,1999,103 min
Ghost Dog: The Way of the Samurai,"Crime, Drama            ",An African-American Mafia hit man who models himself after the samurai of old finds himself targeted for death by the mob.,1999,116 min
Office Space,Comedy            ,Three company workers who hate their jobs decide to rebel against their greedy boss.,1999,89 min
"South Park: Bigger, Longer & Uncut","Animation, Comedy, Fantasy            ","When Stan Marsh and his friends go see an R-rated movie, they start cursing and their parents think that Canada is to blame.",1999,81 min
Summer of Sam,"Crime, Drama, Romance            ","Spike Lee's take on the ""Son of Sam"" murders in New York City during the summer of 1977 centering on the residents of an Italian-American Northeast Bronx neighborhood who live in fear and distrust of one another.",1999,142 min
The Insider,"Biography, Drama, Thriller            ",A research chemist comes under personal and professional attack when he decides to appear in a 60 Minutes exposé on Big Tobacco.,1999,157 min
The Limey,"Crime, Drama, Mystery            ",An extremely volatile and dangerous Englishman goes to Los Angeles to find the man he considers responsible for his daughter's death.,1999,89 min
The Matrix,"Action, Sci-Fi            ","When a beautiful stranger leads computer hacker Neo to a forbidding underworld, he discovers the shocking truth--the life he knows is the elaborate deception of an evil cyber-intelligence.",1999,136 min
The Sixth Sense,"Drama, Mystery, Thriller            ","A frightened, withdrawn Philadelphia boy who communicates with spirits seeks the help of a disheartened child psychologist.",1999,107 min
The Straight Story,"Biography, Drama            ",An old man makes a long journey by lawnmower to mend his relationship with an ill brother.,1999,112 min
The Virgin Suicides,"Drama, Romance            ","A group of male friends become obsessed with five mysterious sisters who are sheltered by their strict, religious parents in suburban Detroit in the mid 1970s.",1999,97 min
Three Kings,"Action, Adventure, Comedy            ","In the aftermath of the Persian Gulf War, four soldiers set out to steal gold that was stolen from Kuwait, but they discover people who desperately need their help.",1999,114 min
Wild Zero,"Comedy, Horror, Music            ",Only legendary Japanese garage rock band Guitar Wolf can stand between a race of aliens from destroying earth with an army of zombies.,1999,98 min
Amores perros,"Drama, Thriller            ","A horrific car accident connects three stories, each involving characters dealing with loss, regret, and life's harsh realities, all in the name of love.",2000,154 min
Batoru rowaiaru,"Action, Adventure, Drama            ","In the future, the Japanese government captures a class of ninth-grade students and forces them to kill each other under the revolutionary ""Battle Royale"" act.",2000,114 min
Best in Show,Comedy            ,A behind-the-scenes look into the highly competitive and cut-throat world of dog shows through the eyes of a group of ruthless dog owners.,2000,90 min
Chuck & Buck,"Comedy, Drama            ",An oddly naive man-child stalks his childhood best friend and tries to reconnect with their past.,2000,96 min
Wo hu cang long,"Action, Adventure, Drama            ",A young Chinese warrior steals a sword from a famed swordsman and then escapes into a world of romantic adventure with a mysterious man in the frontier of the nation.,2000,120 min
Fa Yeung Nin Wah,"Drama, Romance            ","Two neighbors form a strong bond after both suspect extramarital activities of their spouses. However, they agree to keep their bond platonic so as not to commit similar wrongs.",2000,98 min
Memento,"Mystery, Thriller            ",A man with short-term memory loss attempts to track down his wife's murderer.,2000,113 min
Requiem for a Dream,Drama            ,The drug-induced utopias of four Coney Island people are shattered when their addictions run deep.,2000,102 min
Sexy Beast,"Crime, Drama, Thriller            ","Brutal gangster Don Logan recruits ""retired"" safecracker Gal for one last job, but it goes badly for both of them.",2000,89 min
Sånger från andra våningen,"Comedy, Drama            ","Where are we humans going? A film poem inspired by the Peruvian poet César Vallejo. We meet people in the city. People trying to communicate, searching compassion and get the connection of small and large things.",2000,98 min
The Filth and the Fury,"Documentary, Biography, Music            ","A film about the career of the notorious punk rock band, the Sex Pistols.",2000,108 min
The Low Down,Drama            ,Relationships as they are really lived.,2000,96 min
Le fabuleux destin d'Amélie Poulain,"Comedy, Romance            ","Amélie is an innocent and naive girl in Paris with her own sense of justice. She decides to help those around her and, along the way, discovers love.",2001,122 min
Donnie Darko,"Drama, Mystery, Sci-Fi            ","After narrowly escaping a bizarre accident, a troubled teenager is plagued by visions of a man in a large rabbit suit who manipulates him to commit a series of crimes.",2001,113 min
Frailty,"Crime, Drama, Thriller            ","A mysterious man arrives at the offices of an FBI agent and recounts his childhood: how his religious fanatic father received visions telling him to destroy people who were in fact ""demons.""",2001,100 min
Jeepers Creepers,"Horror, Mystery            ",A brother and sister driving home through isolated countryside for spring break encounter a flesh-eating creature which is in the midst of its ritualistic eating spree.,2001,90 min
Mulholland Dr.,"Drama, Mystery, Thriller            ","After a car wreck on the winding Mulholland Drive renders a woman amnesiac, she and a perky Hollywood-hopeful search for clues and answers across Los Angeles in a twisting venture beyond dreams and reality.",2001,147 min
Ocean's Eleven,"Crime, Thriller            ",Danny Ocean and his ten accomplices plan to rob three Las Vegas casinos simultaneously.,2001,116 min
Siu Lam juk kau,"Action, Comedy, Fantasy            ",A young Shaolin follower reunites with his discouraged brothers to form a soccer team using their martial art skills to their advantage.,2001,113 min
Sen to Chihiro no kamikakushi,"Animation, Adventure, Family            ","During her family's move to the suburbs, a sullen 10-year-old girl wanders into a world ruled by gods, witches, and spirits, and where humans are changed into beasts.",2001,125 min
El espinazo del diablo,"Drama, Horror, Thriller            ","After Carlos - a 12-year-old whose father has died in the Spanish Civil War - arrives at an ominous boys' orphanage, he discovers the school is haunted and has many dark secrets which he must uncover.",2001,106 min
The Lord of the Rings: The Fellowship of the Ring,"Action, Adventure, Drama            ",A meek Hobbit from the Shire and eight companions set out on a journey to destroy the powerful One Ring and save Middle-earth from the Dark Lord Sauron.,2001,178 min
The Others,"Horror, Mystery, Thriller            ",A woman who lives in her darkened old family house with her two photosensitive children becomes convinced that the home is haunted.,2001,101 min
The Royal Tenenbaums,"Comedy, Drama            ",The eccentric members of a dysfunctional family reluctantly gather under the same roof for various reasons.,2001,110 min
Training Day,"Action, Crime, Drama            ",A rookie cop spends his first day as a Los Angeles narcotics officer with a rogue detective who isn't what he appears to be.,2001,122 min
Y tu mamá también,Drama            ,"In Mexico, two teenage boys and an attractive older woman embark on a road trip and learn a thing or two about life, friendship, sex, and each other.",2001,106 min
24 Hour Party People,"Biography, Comedy, Drama            ","In 1976, Tony Wilson sets up Factory Records and brings Manchester's music to the world.",2002,117 min
Adaptation.,"Comedy, Drama            ",A lovelorn screenwriter becomes desperate as he tries and fails to adapt 'The Orchid Thief' by Susan Orlean for the screen.,2002,115 min
Cidade de Deus,"Crime, Drama            ","In the slums of Rio, two kids' paths diverge as one struggles to become a photographer and the other a kingpin.",2002,130 min
Ying xiong,"Action, Adventure, Drama            ","A defense officer, Nameless, was summoned by the King of Qin regarding his success of terminating three warriors.",2002,120 min
Mou gaan dou,"Action, Crime, Drama            ","A story between a mole in the police department and an undercover cop. Their objectives are the same: to find out who is the mole, and who is the cop.",2002,101 min
Irréversible,"Crime, Drama, Mystery            ",Events over the course of one traumatic night in Paris unfold in reverse-chronological order as the beautiful Alex is brutally raped and beaten by a stranger in an underpass tunnel.,2002,97 min
Boksuneun naui geot,"Crime, Drama, Thriller            ","A recently laid off factory worker kidnaps his former boss' friend's daughter, hoping to use the ransom money to pay for his sister's kidney transplant.",2002,129 min
Good Bye Lenin!,"Comedy, Drama, Romance            ","In 1990, to protect his fragile mother from a fatal shock after a long coma, a young man must keep her from learning that her beloved nation of East Germany as she knew it has disappeared.",2003,121 min
Haute tension,Horror            ,"Best friends Marie and Alexia decide to spend a quiet weekend at Alexia's parents' secluded farmhouse. But on the night of their arrival, the girls' idyllic getaway turns into an endless night of horror.",2003,91 min
Kill Bill: Vol. 1,"Action, Crime, Drama            ","After awakening from a four-year coma, a former assassin wreaks vengeance on the team of assassins who betrayed her.",2003,111 min
Los Angeles Plays Itself,"Documentary, History            ",A documentary on how Los Angeles has been used and depicted in the movies.,2003,169 min
Lost in Translation,"Comedy, Drama            ",A faded movie star and a neglected young woman form an unlikely bond after crossing paths in Tokyo.,2003,102 min
Master and Commander: The Far Side of the World,"Action, Adventure, Drama            ","During the Napoleonic Wars, a brash British captain pushes his ship and crew to their limits in pursuit of a formidable French war vessel around South America.",2003,138 min
Salinui chueok,"Crime, Drama, Mystery            ","In a small Korean province in 1986, two detectives struggle with the case of multiple young women being found raped and murdered by an unknown culprit.",2003,131 min
Oldeuboi,"Action, Drama, Mystery            ","After being kidnapped and imprisoned for fifteen years, Oh Dae-Su is released, only to find that he must find his captor in five days.",2003,101 min
Ong-bak,"Action, Crime, Thriller            ","When the head of a statue sacred to a village is stolen, a young martial artist goes to the big city and finds himself taking on the underworld to retrieve it.",2003,108 min
School of Rock,"Comedy, Music            ","After being kicked out of his rock band, Dewey Finn becomes a substitute teacher of an uptight elementary private school, only to try and turn his class into a rock band.",2003,109 min
Les triplettes de Belleville,"Animation, Comedy, Drama            ","When her grandson is kidnapped during the Tour de France, Madame Souza and her beloved pooch Bruno team up with the Belleville Sisters--an aged song-and-dance team from the days of Fred Astaire--to rescue him.",2003,80 min
Windy City Heat,"Documentary, Comedy            ",A man caught up in the glamor of being a Hollywood celebrity has no idea that the production he's in is a fake.,2003 TV Movie,120 min
